{
  "id": "test.ability.ranged_bolt",
  "kind": "ability",
  "displayName": "Ranged Bolt",
  "displayNameKey": "ability.ranged_bolt.name",
  "descriptionKey": "ability.ranged_bolt.desc",
  "targetMode": "entity",
  "relationFilter": "hostile",
  "range": 180,
  "minimumRange": 0,
  "areaShape": "none",
  "areaRadius": 0,
  "castTime": 0.4,
  "channelTime": 0,
  "globalCooldown": 0.5,
  "individualCooldown": 1.2,
  "resourceCosts": [{ "resourceId": "test.resource.mana", "amount": 8 }],
  "movementInterruptsCast": true,
  "damageInterruptsCast": true,
  "requiredLevel": 1,
  "requiredClassTags": [],
  "prerequisites": [],
  "effects": [
    {
      "id": "bolt",
      "type": "direct_damage",
      "source": "caster",
      "target": "primary",
      "magnitude": { "kind": "constant", "value": 6 },
      "duration": 0,
      "tickInterval": 0,
      "stackPolicy": "replace",
      "maxStacks": 1,
      "refreshPolicy": "refresh",
      "removalReason": "expired",
      "tags": ["arcane"]
    }
  ],
  "animationAssetId": "visual.ability_bolt",
  "iconAssetId": "visual.ability_bolt_icon",
  "soundAssetId": "visual.ability_bolt_sound",
  "skillPointCost": 1,
  "maxRank": 1
}
