{
  "id": "ability.mage.absolute_zero",
  "kind": "ability",
  "displayName": "Absolute Zero",
  "displayNameKey": "ability.mage.absolute_zero.display_name",
  "descriptionKey": "ability.mage.absolute_zero.description",
  "targetMode": "self",
  "relationFilter": "hostile",
  "range": 40,
  "minimumRange": 0,
  "areaShape": "circle",
  "areaRadius": 40,
  "castTime": 0,
  "channelTime": 0,
  "globalCooldown": 0,
  "individualCooldown": 90,
  "resourceCosts": [],
  "movementInterruptsCast": false,
  "damageInterruptsCast": false,
  "requiredLevel": 10,
  "requiredClassTags": [
    "class.mage"
  ],
  "prerequisites": [],
  "effects": [
    {
      "id": "freeze",
      "type": "stun",
      "source": "caster",
      "target": "area",
      "magnitude": {
        "kind": "constant",
        "value": 0
      },
      "duration": 4,
      "tickInterval": 0,
      "stackPolicy": "replace",
      "maxStacks": 1,
      "refreshPolicy": "refresh",
      "removalReason": "expired",
      "tags": [
        "freeze",
        "capstone"
      ],
      "school": "spell"
    }
  ],
  "effectIds": [
    "effect.mage.absolute_zero.freeze"
  ],
  "animationAssetId": "visual.ability_bolt",
  "iconAssetId": "visual.ability_bolt_icon",
  "soundAssetId": "visual.ability_bolt_sound",
  "skillPointCost": 0,
  "maxRank": 1,
  "runtimeEnabled": true,
  "abilityCategory": "capstone",
  "ownerClassId": "class.mage",
  "school": "spell",
  "classification": "canonical",
  "compileTimeAddition": false,
  "ownerBranchId": "branch.mage.frost"
}
