{
  "id": "ability.marksman.barrage",
  "kind": "ability",
  "displayName": "Barrage",
  "displayNameKey": "ability.marksman.barrage.display_name",
  "descriptionKey": "ability.marksman.barrage.description",
  "targetMode": "entity",
  "relationFilter": "hostile",
  "range": 180,
  "minimumRange": 0,
  "areaShape": "none",
  "areaRadius": 0,
  "castTime": 0,
  "channelTime": 0,
  "globalCooldown": 0,
  "individualCooldown": 5,
  "resourceCosts": [],
  "movementInterruptsCast": false,
  "damageInterruptsCast": false,
  "requiredLevel": 5,
  "requiredClassTags": [
    "class.marksman"
  ],
  "prerequisites": [],
  "effects": [
    {
      "id": "hit",
      "type": "direct_damage",
      "source": "caster",
      "target": "primary",
      "magnitude": {
        "kind": "stat_id",
        "statId": "stat.agility",
        "value": 6,
        "scale": 0.01
      },
      "duration": 0,
      "tickInterval": 0,
      "stackPolicy": "replace",
      "maxStacks": 1,
      "refreshPolicy": "refresh",
      "removalReason": "expired",
      "tags": [
        "ranged"
      ],
      "school": "ranged",
      "hitCount": 3,
      "independentCrit": true
    }
  ],
  "effectIds": [
    "effect.marksman.barrage.hit"
  ],
  "animationAssetId": "visual.ability_bolt",
  "iconAssetId": "visual.ability_bolt_icon",
  "soundAssetId": "visual.ability_bolt_sound",
  "skillPointCost": 0,
  "maxRank": 1,
  "runtimeEnabled": true,
  "abilityCategory": "signature",
  "ownerClassId": "class.marksman",
  "school": "ranged",
  "classification": "canonical",
  "compileTimeAddition": false,
  "ownerBranchId": "branch.marksman.skirmisher",
  "hitCount": 3,
  "independentCrit": true
}
