{
  "id": "test.ability.enemy_melee",
  "kind": "ability",
  "displayName": "Enemy Melee",
  "displayNameKey": "ability.enemy_melee.name",
  "descriptionKey": "ability.enemy_melee.desc",
  "targetMode": "entity",
  "relationFilter": "hostile",
  "range": 32,
  "minimumRange": 0,
  "areaShape": "none",
  "areaRadius": 0,
  "castTime": 0,
  "channelTime": 0,
  "globalCooldown": 1.4,
  "individualCooldown": 1.4,
  "resourceCosts": [],
  "movementInterruptsCast": false,
  "damageInterruptsCast": false,
  "requiredLevel": 1,
  "requiredClassTags": [],
  "prerequisites": [],
  "effects": [
    {
      "id": "hit",
      "type": "direct_damage",
      "source": "caster",
      "target": "primary",
      "magnitude": { "kind": "constant", "value": 3 },
      "duration": 0,
      "tickInterval": 0,
      "stackPolicy": "replace",
      "maxStacks": 1,
      "refreshPolicy": "refresh",
      "removalReason": "expired",
      "tags": ["physical"]
    }
  ],
  "animationAssetId": "visual.ability_melee",
  "iconAssetId": "visual.ability_melee_icon",
  "soundAssetId": "visual.ability_melee_sound",
  "skillPointCost": 0,
  "maxRank": 1
}
