{
  "id": "ability.marksman.vault",
  "kind": "ability",
  "displayName": "Vault",
  "displayNameKey": "ability.marksman.vault.display_name",
  "descriptionKey": "ability.marksman.vault.description",
  "targetMode": "self",
  "relationFilter": "self",
  "range": 0,
  "minimumRange": 0,
  "areaShape": "none",
  "areaRadius": 0,
  "castTime": 0,
  "channelTime": 0,
  "globalCooldown": 0,
  "individualCooldown": 15,
  "resourceCosts": [],
  "movementInterruptsCast": false,
  "damageInterruptsCast": false,
  "requiredLevel": 5,
  "requiredClassTags": [
    "class.marksman"
  ],
  "prerequisites": [],
  "effects": [
    {
      "id": "leap",
      "type": "movement",
      "source": "caster",
      "target": "self",
      "magnitude": {
        "kind": "constant",
        "value": 0
      },
      "duration": 0,
      "tickInterval": 0,
      "stackPolicy": "replace",
      "maxStacks": 1,
      "refreshPolicy": "refresh",
      "removalReason": "expired",
      "tags": [
        "mobility"
      ],
      "school": "none",
      "movementKind": "leap",
      "movementDistance": 80
    },
    {
      "id": "haste",
      "type": "timed_stat_modifier",
      "source": "caster",
      "target": "self",
      "magnitude": {
        "kind": "constant",
        "value": 0.3
      },
      "duration": 2,
      "tickInterval": 0,
      "stackPolicy": "replace",
      "maxStacks": 1,
      "refreshPolicy": "refresh",
      "removalReason": "expired",
      "tags": [
        "buff"
      ],
      "school": "none",
      "statChannel": "move_speed"
    }
  ],
  "effectIds": [
    "effect.marksman.vault.leap",
    "effect.marksman.vault.haste"
  ],
  "animationAssetId": "visual.ability_buff",
  "iconAssetId": "visual.ability_buff_icon",
  "soundAssetId": "visual.ability_buff_sound",
  "skillPointCost": 0,
  "maxRank": 1,
  "runtimeEnabled": true,
  "abilityCategory": "tree_active",
  "ownerClassId": "class.marksman",
  "school": "none",
  "classification": "canonical",
  "compileTimeAddition": false,
  "ownerBranchId": "branch.marksman.skirmisher"
}
