{
  "id": "test.ability.boss_nova",
  "kind": "ability",
  "displayName": "Boss Nova",
  "displayNameKey": "ability.boss_nova.name",
  "descriptionKey": "ability.boss_nova.desc",
  "targetMode": "entity",
  "relationFilter": "hostile",
  "range": 80,
  "minimumRange": 0,
  "areaShape": "none",
  "areaRadius": 0,
  "castTime": 0.5,
  "channelTime": 0,
  "globalCooldown": 3,
  "individualCooldown": 3,
  "resourceCosts": [],
  "movementInterruptsCast": true,
  "damageInterruptsCast": false,
  "requiredLevel": 1,
  "requiredClassTags": [],
  "prerequisites": [],
  "effects": [
    {
      "id": "nova",
      "type": "direct_damage",
      "source": "caster",
      "target": "primary",
      "magnitude": { "kind": "constant", "value": 8 },
      "duration": 0,
      "tickInterval": 0,
      "stackPolicy": "replace",
      "maxStacks": 1,
      "refreshPolicy": "refresh",
      "removalReason": "expired",
      "tags": ["arcane"]
    }
  ],
  "animationAssetId": "visual.ability_dot",
  "iconAssetId": "visual.ability_dot_icon",
  "soundAssetId": "visual.ability_dot_sound",
  "skillPointCost": 0,
  "maxRank": 1
}
