{
  "id": "ability.mystic.benediction",
  "kind": "ability",
  "displayName": "Benediction",
  "displayNameKey": "ability.mystic.benediction.display_name",
  "descriptionKey": "ability.mystic.benediction.description",
  "targetMode": "self",
  "relationFilter": "friendly",
  "range": 80,
  "minimumRange": 0,
  "areaShape": "circle",
  "areaRadius": 80,
  "castTime": 0,
  "channelTime": 0,
  "globalCooldown": 0,
  "individualCooldown": 90,
  "resourceCosts": [],
  "movementInterruptsCast": false,
  "damageInterruptsCast": false,
  "requiredLevel": 10,
  "requiredClassTags": [
    "class.mystic"
  ],
  "prerequisites": [],
  "effects": [
    {
      "id": "heal",
      "type": "direct_heal",
      "source": "caster",
      "target": "area",
      "magnitude": {
        "kind": "constant",
        "value": 0
      },
      "duration": 0,
      "tickInterval": 0,
      "stackPolicy": "replace",
      "maxStacks": 1,
      "refreshPolicy": "refresh",
      "removalReason": "expired",
      "tags": [
        "heal",
        "capstone"
      ],
      "school": "heal",
      "healthPercent": 0.3
    },
    {
      "id": "shield",
      "type": "shield",
      "source": "caster",
      "target": "area",
      "magnitude": {
        "kind": "constant",
        "value": 0
      },
      "duration": 4,
      "tickInterval": 0,
      "stackPolicy": "replace",
      "maxStacks": 1,
      "refreshPolicy": "refresh",
      "removalReason": "expired",
      "tags": [
        "shield",
        "capstone"
      ],
      "school": "heal",
      "healthPercent": 0.1
    }
  ],
  "effectIds": [
    "effect.mystic.benediction.heal",
    "effect.mystic.benediction.shield"
  ],
  "animationAssetId": "visual.ability_heal",
  "iconAssetId": "visual.ability_heal_icon",
  "soundAssetId": "visual.ability_heal_sound",
  "skillPointCost": 0,
  "maxRank": 1,
  "runtimeEnabled": true,
  "abilityCategory": "capstone",
  "ownerClassId": "class.mystic",
  "school": "heal",
  "classification": "compile-time-addition",
  "compileTimeAddition": true,
  "ownerBranchId": "branch.mystic.charms"
}
