{
  "id": "test.ability.small_heal",
  "kind": "ability",
  "displayName": "Small Heal",
  "displayNameKey": "ability.small_heal.name",
  "descriptionKey": "ability.small_heal.desc",
  "targetMode": "self",
  "relationFilter": "self",
  "range": 0,
  "minimumRange": 0,
  "areaShape": "none",
  "areaRadius": 0,
  "castTime": 0.5,
  "channelTime": 0,
  "globalCooldown": 0.5,
  "individualCooldown": 2,
  "resourceCosts": [{ "resourceId": "test.resource.mana", "amount": 10 }],
  "movementInterruptsCast": true,
  "damageInterruptsCast": true,
  "requiredLevel": 1,
  "requiredClassTags": [],
  "prerequisites": [],
  "effects": [
    {
      "id": "heal",
      "type": "direct_heal",
      "source": "caster",
      "target": "self",
      "magnitude": { "kind": "constant", "value": 15 },
      "duration": 0,
      "tickInterval": 0,
      "stackPolicy": "replace",
      "maxStacks": 1,
      "refreshPolicy": "refresh",
      "removalReason": "expired",
      "tags": ["holy"]
    }
  ],
  "animationAssetId": "visual.ability_heal",
  "iconAssetId": "visual.ability_heal_icon",
  "soundAssetId": "visual.ability_heal_sound",
  "skillPointCost": 1,
  "maxRank": 1
}
