{
  "id": "test.ability.power_buff",
  "kind": "ability",
  "displayName": "Power Buff",
  "displayNameKey": "ability.power_buff.name",
  "descriptionKey": "ability.power_buff.desc",
  "targetMode": "self",
  "relationFilter": "self",
  "range": 0,
  "minimumRange": 0,
  "areaShape": "none",
  "areaRadius": 0,
  "castTime": 0,
  "channelTime": 0,
  "globalCooldown": 0.5,
  "individualCooldown": 8,
  "resourceCosts": [{ "resourceId": "test.resource.mana", "amount": 6 }],
  "movementInterruptsCast": false,
  "damageInterruptsCast": false,
  "requiredLevel": 1,
  "requiredClassTags": [],
  "prerequisites": [],
  "effects": [
    {
      "id": "might",
      "type": "timed_stat_modifier",
      "source": "caster",
      "target": "self",
      "magnitude": { "kind": "constant", "value": 4 },
      "duration": 5,
      "tickInterval": 0,
      "stackPolicy": "refresh",
      "maxStacks": 1,
      "refreshPolicy": "refresh",
      "removalReason": "expired",
      "tags": ["buff"],
      "statChannel": "attack"
    }
  ],
  "animationAssetId": "visual.ability_buff",
  "iconAssetId": "visual.ability_buff_icon",
  "soundAssetId": "visual.ability_buff_sound",
  "skillPointCost": 1,
  "maxRank": 2
}
