{
  "id": "test.ability.enemy_cast",
  "kind": "ability",
  "displayName": "Enemy Cast",
  "displayNameKey": "ability.enemy_cast.name",
  "descriptionKey": "ability.enemy_cast.desc",
  "targetMode": "entity",
  "relationFilter": "hostile",
  "range": 160,
  "minimumRange": 0,
  "areaShape": "none",
  "areaRadius": 0,
  "castTime": 0.8,
  "channelTime": 0,
  "globalCooldown": 2,
  "individualCooldown": 2,
  "resourceCosts": [],
  "movementInterruptsCast": true,
  "damageInterruptsCast": false,
  "requiredLevel": 1,
  "requiredClassTags": [],
  "prerequisites": [],
  "effects": [
    {
      "id": "burst",
      "type": "direct_damage",
      "source": "caster",
      "target": "primary",
      "magnitude": { "kind": "constant", "value": 7 },
      "duration": 0,
      "tickInterval": 0,
      "stackPolicy": "replace",
      "maxStacks": 1,
      "refreshPolicy": "refresh",
      "removalReason": "expired",
      "tags": ["arcane"]
    }
  ],
  "animationAssetId": "visual.ability_bolt",
  "iconAssetId": "visual.ability_bolt_icon",
  "soundAssetId": "visual.ability_bolt_sound",
  "skillPointCost": 0,
  "maxRank": 1
}
